{
  "schema_version": "sb60-v1",
  "id": "sb-08-01",
  "meta_prompt_id": "mp-c08-v1",
  "cluster": "08 Memory & agent harnesses",
  "repo": "manutej/kraken-omnimemory-mcp",
  "capability": "Every recalled answer carries its source",
  "audience": "Everyone",
  "wada": 296,
  "bpm": 128,
  "dur": 60.3,
  "title": "Every answer keeps its <i>receipt</i>.",
  "hook": {
    "kind": "Example",
    "picture": "Close on the whale reading a pod's answer card aloud. The card has no tick in its corner. A customer pod takes the answer and turns a copper ✕.",
    "words": "The bot said the policy changed."
  },
  "problem_in_viewer_words": {
    "kind": "Fact",
    "body": "The bot quoted a rule, and nobody could say where from.",
    "who": "support lead after a wrong refund"
  },
  "why_it_keeps_happening": {
    "kind": "Fact",
    "picture": "Pull back: three heaps of cards (chat, code, docs) feed one pod. First answer leaves with no tick and a pod turns ✕ (2 beats). It repeats, faster each time.",
    "words": "Answers arrive with no name on them."
  },
  "stakes": {
    "kind": "Fact",
    "body": "A wrong answer gets acted on, and nobody can trace it, fix it at the source, or warn anyone else."
  },
  "solution_hint": "Tag each note with where it came from.",
  "metaphor": {
    "kind": "Example",
    "body": "Every card the pod brings back has a small tick in its corner, and a thin line runs from that tick back to the exact message it came from. Copper alarm.",
    "symbols": [
      "whale",
      "line",
      "atom",
      "tick",
      "pod"
    ]
  },
  "mechanism_beats": {
    "kind": "Method",
    "steps": [
      {
        "t": 18.75,
        "picture": "Cards rise from the three heaps. The whale stamps a tick on each one: chat, code, docs. Each tick shows a place, a time and a name.",
        "words": "Tag each note: where, when, who.",
        "sound": "Signature tick, in tune, one per stamp"
      },
      {
        "t": 22.5,
        "picture": "A pod asks one question. Cards from all three heaps rise together and line up in front of it, every tick showing.",
        "words": "One search across all three places.",
        "sound": "Three ticks in a chord"
      },
      {
        "t": 24.375,
        "picture": "Push-in: the whale taps the top card's tick. A thin line runs back across the sea to one exact chat message, with its time and author lit.",
        "words": "Tap it. Find it.",
        "sound": "Rising two-note figure"
      },
      {
        "t": 26.25,
        "picture": "The thin line glows and stays. The tick is now visibly the start of a trail.",
        "words": "Where it came from: provenance.",
        "sound": "The tick rings and holds"
      }
    ]
  },
  "real_case": {
    "kind": "Evidence",
    "claim": "OmniMemory (in development) states that each search result includes source attribution with platform, timestamp and author metadata, across Slack, GitHub and Google Drive.",
    "numbers": [],
    "source": {
      "kind": "repo",
      "title": "manutej/kraken-omnimemory-mcp README",
      "url": "https://github.com/manutej/kraken-omnimemory-mcp"
    },
    "verified": true,
    "illustrative": true
  },
  "honest_limit": {
    "kind": "Constraint",
    "picture": "Push into one tagged card: its tick is perfect, but its body carries a copper smudge. The pod quotes it and a reader pod turns ✕. The tick never changed.",
    "words": "A tagged note can still be wrong."
  },
  "not_this": {
    "kind": "Constraint",
    "body": "A source tag is not a fact check."
  },
  "ending_pattern": {
    "kind": "Example",
    "slug": "trace-back-trail",
    "body": "The same answer card as act 1, now with a tick and a glowing trail to its source. The whale follows it home before the customer acts.",
    "callback": "Act 1's blank card corner now holds a tick with a trail, so the copper ✕ never lands."
  },
  "end_belief": {
    "kind": "Goal",
    "body": "Ask every answer where it came from."
  },
  "beats": [
    {
      "t": 0.0,
      "picture": "Close on the whale reading a pod's answer card: \"refund rule changed\". The card's corner, where a tick should sit, is empty.",
      "words": "The bot said the policy changed.",
      "sound": "Dry wood tick, muffled and late",
      "act": "felt",
      "bars": "1",
      "camera": "Close, z 1.6, on the whale",
      "cue_tags": [
        "focus"
      ]
    },
    {
      "t": 1.875,
      "picture": "A customer pod acts on the answer and turns a copper ✕.",
      "words": "",
      "sound": "Dull thunk",
      "act": "felt",
      "bars": "2",
      "camera": "Close, z 1.6, on the whale",
      "cue_tags": [
        "consequence",
        "focus"
      ]
    },
    {
      "t": 3.75,
      "picture": "The whale turns the card over, looking for a name or date. Blank both sides.",
      "words": "Nobody could say where it came from.",
      "sound": "Muffled tick again, off the beat",
      "act": "felt",
      "bars": "3-4",
      "camera": "Close, z 1.6, on the whale",
      "cue_tags": [
        "focus"
      ]
    },
    {
      "t": 7.5,
      "picture": "The whale stares at the blank card. Hold, with only breathing.",
      "words": "",
      "sound": "Silence creeps in",
      "act": "felt",
      "bars": "5",
      "camera": "Close, z 1.6, on the whale",
      "cue_tags": [
        "focus"
      ]
    },
    {
      "t": 10.312,
      "picture": "Hinge: half a bar of stillness, then SERIES.open shows the title.",
      "words": "Every answer keeps its receipt.",
      "sound": "Near-silence, then the title tick",
      "act": "why",
      "bars": "6",
      "camera": "Still, z 1.6",
      "cue_tags": [
        "hinge"
      ]
    },
    {
      "t": 11.25,
      "picture": "Pull back: three heaps of cards (chat, code, docs) feed one pod. First answer leaves with no tick and a pod turns ✕ (2 beats).",
      "words": "",
      "sound": "Problem motif: muffled tick",
      "act": "why",
      "bars": "7",
      "camera": "Pull back to z 1.0, revealing the pattern",
      "cue_tags": [
        "focus"
      ]
    },
    {
      "t": 13.125,
      "picture": "Second answer, no tick, a second pod ✕ (1 beat).",
      "words": "Answers arrive with no name on them.",
      "sound": "Muffled tick, faster",
      "act": "why",
      "bars": "8",
      "camera": "Pull back to z 1.0, revealing the pattern",
      "cue_tags": [
        "focus"
      ]
    },
    {
      "t": 15.0,
      "picture": "Third answer, no tick, third pod ✕ (half a beat). Three blank corners in a row.",
      "words": "",
      "sound": "Muffled tick, fastest",
      "act": "why",
      "bars": "9",
      "camera": "Pull back to z 1.0, revealing the pattern",
      "cue_tags": [
        "focus"
      ]
    },
    {
      "t": 16.875,
      "picture": "All motion stops. A faint ghost tick appears in each card's corner.",
      "words": "Tag each note with where it came from.",
      "sound": "One clean wood tick: the signature, first time",
      "act": "why",
      "bars": "10",
      "camera": "Still, z 1.0",
      "cue_tags": [
        "focus"
      ]
    },
    {
      "t": 18.75,
      "picture": "Cards rise from the three heaps. The whale stamps a tick on each one: chat, code, docs. Each tick shows a place, a time and a name.",
      "words": "Tag each note: where, when, who.",
      "sound": "Signature tick, in tune, one per stamp",
      "act": "move",
      "bars": "11",
      "camera": "Medium, z 1.2",
      "cue_tags": [
        "mech"
      ]
    },
    {
      "t": 22.5,
      "picture": "A pod asks one question. Cards from all three heaps rise together and line up in front of it, every tick showing.",
      "words": "One search across all three places.",
      "sound": "Three ticks in a chord",
      "act": "move",
      "bars": "13",
      "camera": "Medium, z 1.2",
      "cue_tags": [
        "mech"
      ]
    },
    {
      "t": 24.375,
      "picture": "Push-in: the whale taps the top card's tick. A thin line runs back across the sea to one exact chat message, with its time and author lit.",
      "words": "Tap it. Find it.",
      "sound": "Rising two-note figure",
      "act": "move",
      "bars": "14",
      "camera": "Push-in to z 1.3 on the decisive moment",
      "cue_tags": [
        "mech",
        "focus"
      ]
    },
    {
      "t": 26.25,
      "picture": "The thin line glows and stays. The tick is now visibly the start of a trail.",
      "words": "Where it came from: provenance.",
      "sound": "The tick rings and holds",
      "act": "move",
      "bars": "15",
      "camera": "Medium, z 1.2",
      "cue_tags": [
        "mech"
      ]
    },
    {
      "t": 30.0,
      "picture": "Wide: three heaps (chat, code, docs) feed one sea. Many cards rise, each with its tick and a faint trail line home.",
      "words": "Built to search chat, code and docs.",
      "sound": "Pulse bed, quiet ticks",
      "act": "case",
      "bars": "17-19",
      "camera": "Steady wide, slow drift",
      "cue_tags": [
        "focus"
      ]
    },
    {
      "t": 35.625,
      "picture": "The whale follows one tick back to an issue in the code heap. A ring marks the source.",
      "words": "Every result names place, time and author.",
      "sound": "Two-note figure, resolved",
      "act": "case",
      "bars": "20-22",
      "camera": "Steady wide, slow drift",
      "cue_tags": [
        "focus"
      ]
    },
    {
      "t": 41.25,
      "picture": "Push into one tagged card: its tick is perfect, but its body carries a copper smudge. The pod quotes it and a reader pod turns ✕. The tick never changed.",
      "words": "A tagged note can still be wrong.",
      "sound": "Signature tick plays once, unresolved",
      "act": "limit",
      "bars": "23-24",
      "camera": "Still, then one slow push to what slipped",
      "cue_tags": [
        "limit",
        "focus"
      ]
    },
    {
      "t": 44.062,